{
  "fixtureVersion": 1,
  "synthetic": true,
  "identity": {
    "installationId": "11111111-1111-4111-8111-111111111111",
    "datasetId": "22222222-2222-4222-8222-222222222222",
    "restoreEpoch": "33333333-3333-4333-8333-333333333333"
  },
  "scenarios": [
    {
      "id": "read-present",
      "rule": "read",
      "request": {
        "method": "GET",
        "path": "/v1/records/synthetic-mass-001",
        "headers": {
          "Authorization": "Bearer synthetic-agent-token"
        },
        "body": null
      },
      "response": {
        "status": 200,
        "headers": {},
        "body": {
          "data": {
            "record": {
              "recordId": "synthetic-mass-001",
              "kind": "body_mass",
              "value": 72,
              "unit": "kg",
              "observedAt": "2026-01-01T12:00:00Z",
              "receivedAt": "2026-01-01T12:01:00Z",
              "provenance": {
                "sourceId": "synthetic-manual",
                "sourceKind": "manual"
              },
              "freshness": {
                "status": "fresh",
                "asOf": "2026-01-01T12:01:00Z"
              },
              "missingness": null
            }
          },
          "meta": {
            "installationId": "11111111-1111-4111-8111-111111111111",
            "datasetId": "22222222-2222-4222-8222-222222222222",
            "restoreEpoch": "33333333-3333-4333-8333-333333333333",
            "dataRevision": 1
          }
        }
      },
      "before": {
        "dataRevision": 1,
        "recordCount": 1
      },
      "after": {
        "dataRevision": 1,
        "recordCount": 1
      },
      "context": {
        "grants": [
          "records:read"
        ]
      }
    },
    {
      "id": "read-missing",
      "rule": "read",
      "request": {
        "method": "GET",
        "path": "/v1/records/synthetic-missing",
        "headers": {
          "Authorization": "Bearer synthetic-agent-token"
        },
        "body": null
      },
      "response": {
        "status": 404,
        "headers": {},
        "body": {
          "error": {
            "code": "record_not_found",
            "retryable": false
          },
          "meta": {
            "installationId": "11111111-1111-4111-8111-111111111111",
            "datasetId": "22222222-2222-4222-8222-222222222222",
            "restoreEpoch": "33333333-3333-4333-8333-333333333333",
            "dataRevision": 1
          }
        }
      },
      "before": {
        "dataRevision": 1,
        "recordCount": 1
      },
      "after": {
        "dataRevision": 1,
        "recordCount": 1
      },
      "context": {
        "grants": [
          "records:read"
        ]
      }
    },
    {
      "id": "capabilities",
      "rule": "capabilities",
      "request": {
        "method": "GET",
        "path": "/v1/capabilities",
        "headers": {
          "Authorization": "Bearer synthetic-agent-token"
        },
        "body": null
      },
      "response": {
        "status": 200,
        "headers": {},
        "body": {
          "data": {
            "apiMajor": 1,
            "pairingProtocol": 1,
            "phonePayloadSchema": 1,
            "extensionApi": 1,
            "operations": [
              "records.read",
              "records.write"
            ],
            "sources": [
              {
                "sourceId": "synthetic-manual",
                "availability": "empty",
                "lastSuccessAt": null,
                "freshness": "unknown",
                "missingness": "no_records"
              },
              {
                "sourceId": "synthetic-optional",
                "availability": "disabled",
                "lastSuccessAt": null,
                "freshness": "unknown",
                "missingness": "not_configured"
              },
              {
                "sourceId": "synthetic-healthkit",
                "availability": "available",
                "lastSuccessAt": "2026-01-01T12:00:00Z",
                "freshness": "fresh",
                "missingness": "no_data_or_denied_read"
              },
              {
                "sourceId": "synthetic-stale",
                "availability": "available",
                "lastSuccessAt": "2025-12-01T12:00:00Z",
                "freshness": "stale",
                "missingness": null
              },
              {
                "sourceId": "synthetic-unavailable",
                "availability": "unavailable",
                "lastSuccessAt": null,
                "freshness": "unknown",
                "missingness": "source_error"
              }
            ]
          },
          "meta": {
            "installationId": "11111111-1111-4111-8111-111111111111",
            "datasetId": "22222222-2222-4222-8222-222222222222",
            "restoreEpoch": "33333333-3333-4333-8333-333333333333",
            "dataRevision": 0
          }
        }
      },
      "before": {
        "dataRevision": 0,
        "recordCount": 0
      },
      "after": {
        "dataRevision": 0,
        "recordCount": 0
      },
      "context": {
        "grants": [
          "records:read"
        ]
      }
    },
    {
      "id": "write-create",
      "rule": "write",
      "request": {
        "method": "PUT",
        "path": "/v1/records/synthetic-mass-001",
        "headers": {
          "Authorization": "Bearer synthetic-agent-token",
          "X-Installation-ID": "11111111-1111-4111-8111-111111111111",
          "X-Dataset-ID": "22222222-2222-4222-8222-222222222222",
          "X-Restore-Epoch": "33333333-3333-4333-8333-333333333333",
          "Idempotency-Key": "synthetic-write-001",
          "If-Match": "\"rev-0\""
        },
        "body": {
          "kind": "body_mass",
          "value": 72,
          "unit": "kg",
          "observedAt": "2026-01-01T12:00:00Z",
          "sourceId": "synthetic-manual"
        }
      },
      "response": {
        "status": 201,
        "headers": {},
        "body": {
          "data": {
            "record": {
              "recordId": "synthetic-mass-001",
              "kind": "body_mass",
              "value": 72,
              "unit": "kg",
              "observedAt": "2026-01-01T12:00:00Z",
              "receivedAt": "2026-01-01T12:01:00Z",
              "provenance": {
                "sourceId": "synthetic-manual",
                "sourceKind": "manual"
              },
              "freshness": {
                "status": "fresh",
                "asOf": "2026-01-01T12:01:00Z"
              },
              "missingness": null
            }
          },
          "meta": {
            "installationId": "11111111-1111-4111-8111-111111111111",
            "datasetId": "22222222-2222-4222-8222-222222222222",
            "restoreEpoch": "33333333-3333-4333-8333-333333333333",
            "dataRevision": 1
          }
        }
      },
      "before": {
        "dataRevision": 0,
        "recordCount": 0
      },
      "after": {
        "dataRevision": 1,
        "recordCount": 1
      },
      "context": {
        "actorId": "synthetic-agent",
        "grants": [
          "records:write"
        ],
        "allowedSourceIds": [
          "synthetic-manual"
        ],
        "serverNow": "2026-01-01T12:01:00Z"
      }
    },
    {
      "id": "identical-retry",
      "rule": "retry",
      "request": {
        "method": "PUT",
        "path": "/v1/records/synthetic-mass-001",
        "headers": {
          "Authorization": "Bearer synthetic-agent-token",
          "X-Installation-ID": "11111111-1111-4111-8111-111111111111",
          "X-Dataset-ID": "22222222-2222-4222-8222-222222222222",
          "X-Restore-Epoch": "33333333-3333-4333-8333-333333333333",
          "Idempotency-Key": "synthetic-write-001",
          "If-Match": "\"rev-0\""
        },
        "body": {
          "kind": "body_mass",
          "value": 72,
          "unit": "kg",
          "observedAt": "2026-01-01T12:00:00Z",
          "sourceId": "synthetic-manual"
        }
      },
      "response": {
        "status": 201,
        "headers": {
          "Idempotency-Replayed": "true"
        },
        "body": {
          "data": {
            "record": {
              "recordId": "synthetic-mass-001",
              "kind": "body_mass",
              "value": 72,
              "unit": "kg",
              "observedAt": "2026-01-01T12:00:00Z",
              "receivedAt": "2026-01-01T12:01:00Z",
              "provenance": {
                "sourceId": "synthetic-manual",
                "sourceKind": "manual"
              },
              "freshness": {
                "status": "fresh",
                "asOf": "2026-01-01T12:01:00Z"
              },
              "missingness": null
            }
          },
          "meta": {
            "installationId": "11111111-1111-4111-8111-111111111111",
            "datasetId": "22222222-2222-4222-8222-222222222222",
            "restoreEpoch": "33333333-3333-4333-8333-333333333333",
            "dataRevision": 1
          }
        }
      },
      "before": {
        "dataRevision": 1,
        "recordCount": 1
      },
      "after": {
        "dataRevision": 1,
        "recordCount": 1
      },
      "context": {
        "prior": "write-create",
        "actorId": "synthetic-agent",
        "grants": [
          "records:write"
        ],
        "allowedSourceIds": [
          "synthetic-manual"
        ],
        "serverNow": "2026-01-01T12:01:00Z"
      }
    },
    {
      "id": "conflicting-retry",
      "rule": "conflict",
      "request": {
        "method": "PUT",
        "path": "/v1/records/synthetic-mass-001",
        "headers": {
          "Authorization": "Bearer synthetic-agent-token",
          "X-Installation-ID": "11111111-1111-4111-8111-111111111111",
          "X-Dataset-ID": "22222222-2222-4222-8222-222222222222",
          "X-Restore-Epoch": "33333333-3333-4333-8333-333333333333",